
    -----------------------------------------------------------------------
          Psi4: An Open-Source Ab Initio Electronic Structure Package
                               Psi4 1.9.1 release

                         Git: Rev {} zzzzzzz 


    D. G. A. Smith, L. A. Burns, A. C. Simmonett, R. M. Parrish,
    M. C. Schieber, R. Galvelis, P. Kraus, H. Kruse, R. Di Remigio,
    A. Alenaizan, A. M. James, S. Lehtola, J. P. Misiewicz, M. Scheurer,
    R. A. Shaw, J. B. Schriber, Y. Xie, Z. L. Glick, D. A. Sirianni,
    J. S. O'Brien, J. M. Waldrop, A. Kumar, E. G. Hohenstein,
    B. P. Pritchard, B. R. Brooks, H. F. Schaefer III, A. Yu. Sokolov,
    K. Patkowski, A. E. DePrince III, U. Bozkaya, R. A. King,
    F. A. Evangelista, J. M. Turney, T. D. Crawford, C. D. Sherrill,
    J. Chem. Phys. 152(18) 184108 (2020). https://doi.org/10.1063/5.0006002

                            Additional Code Authors
    E. T. Seidl, C. L. Janssen, E. F. Valeev, M. L. Leininger,
    J. F. Gonthier, R. M. Richard, H. R. McAlexander, M. Saitow, X. Wang,
    P. Verma, M. H. Lechner, A. Jiang, S. Behnle, A. G. Heide,
    M. F. Herbst, and D. L. Poole

             Previous Authors, Complete List of Code Contributors,
                       and Citations for Specific Modules
    https://github.com/psi4/psi4/blob/master/codemeta.json
    https://github.com/psi4/psi4/graphs/contributors
    http://psicode.org/psi4manual/master/introduction.html#citing-psifour

    -----------------------------------------------------------------------


    Psi4 started on: Tuesday, 27 January 2026 09:42AM

    Process ID: 82108
    Host:       CHEM9QDFT72ALT
    PSIDATADIR: /Users/jfoley19/miniconda3/envs/psi4_new/share/psi4
    Memory:     500.0 MiB
    Threads:    1
    
  ==> Input File <==

--------------------------------------------------------------------------
# Single point RHF energy and dipole moment for ortho intermediate
memory 4 GB

molecule ortho_intermediate {
1 1
 C                  0.51932475    1.23303451   -0.03194925
 C                  1.94454413    1.26916358   -0.03672882
 C                  2.62037793    0.09283428   -0.02499003
 C                 -0.19603352    0.03013062    0.00102732
 H                 -0.02069420    2.17423764   -0.04336646
 H                  2.48281698    2.20891057   -0.03611879
 H                 -1.27770137    0.03990295    0.01166953
 N                  4.09213475    0.09594076    0.03662979
 O                  4.63930696   -1.02169275    0.14459220
 O                  4.66489883    1.19839699   -0.02327545
 C                  0.49428518   -1.16712649    0.02099746
 H                 -0.03251071   -2.11492669    0.05447935
 C                  1.96291176   -1.21653219   -0.02111314
 H                  2.44359113   -1.96306433    0.61513886
 Br                 2.17304025   -1.94912156   -1.90618750
 units angstrom
 no_com
 no_reorient
}

set {
  basis 6-311G*
  reference rhf
  scf_type df       # Density fitting for speed; remove this line for conventional SCF
}

# Compute the energy
scf_energy = energy('scf')

# Explicitly compute properties to ensure dipole moment is in the output
properties('scf', properties=['dipole'])
--------------------------------------------------------------------------

  Memory set to   3.725 GiB by Python driver.

Scratch directory: /tmp/
   => Libint2 <=

    Primary   basis highest AM E, G, H:  6, 6, 3
    Auxiliary basis highest AM E, G, H:  7, 7, 4
    Onebody   basis highest AM E, G, H:  -, -, -
    Solid Harmonics ordering:            Gaussian

*** tstart() called on CHEM9QDFT72ALT
*** at Tue Jan 27 09:42:26 2026

   => Loading Basis Set <=

    Name: 6-311G*
    Role: ORBITAL
    Keyword: BASIS
    atoms 1-4, 11, 13 entry C          line   114 file /Users/jfoley19/miniconda3/envs/psi4_new/share/psi4/basis/6-311gs.gbs 
    atoms 5-7, 12, 14 entry H          line    37 file /Users/jfoley19/miniconda3/envs/psi4_new/share/psi4/basis/6-311gs.gbs 
    atoms 8           entry N          line   133 file /Users/jfoley19/miniconda3/envs/psi4_new/share/psi4/basis/6-311gs.gbs 
    atoms 9-10        entry O          line   152 file /Users/jfoley19/miniconda3/envs/psi4_new/share/psi4/basis/6-311gs.gbs 
    atoms 15          entry BR         line   819 file /Users/jfoley19/miniconda3/envs/psi4_new/share/psi4/basis/6-311gs.gbs 


         ---------------------------------------------------------
                                   SCF
               by Justin Turney, Rob Parrish, Andy Simmonett
                          and Daniel G. A. Smith
                              RHF Reference
                        1 Threads,   3814 MiB Core
         ---------------------------------------------------------

  ==> Geometry <==

    Molecular point group: c1
    Full point group: C1

    Geometry (in Angstrom), charge = 1, multiplicity = 1:

       Center              X                  Y                   Z               Mass       
    ------------   -----------------  -----------------  -----------------  -----------------
         C            0.519324750000     1.233034510000    -0.031949250000    12.000000000000
         C            1.944544130000     1.269163580000    -0.036728820000    12.000000000000
         C            2.620377930000     0.092834280000    -0.024990030000    12.000000000000
         C           -0.196033520000     0.030130620000     0.001027320000    12.000000000000
         H           -0.020694200000     2.174237640000    -0.043366460000     1.007825032230
         H            2.482816980000     2.208910570000    -0.036118790000     1.007825032230
         H           -1.277701370000     0.039902950000     0.011669530000     1.007825032230
         N            4.092134750000     0.095940760000     0.036629790000    14.003074004430
         O            4.639306960000    -1.021692750000     0.144592200000    15.994914619570
         O            4.664898830000     1.198396990000    -0.023275450000    15.994914619570
         C            0.494285180000    -1.167126490000     0.020997460000    12.000000000000
         H           -0.032510710000    -2.114926690000     0.054479350000     1.007825032230
         C            1.962911760000    -1.216532190000    -0.021113140000    12.000000000000
         H            2.443591130000    -1.963064330000     0.615138860000     1.007825032230
         BR           2.173040250000    -1.949121560000    -1.906187500000    78.918337600000

  Running in c1 symmetry.

  Rotational constants: A =      0.03196  B =      0.00967  C =      0.00783 [cm^-1]
  Rotational constants: A =    958.25927  B =    290.01491  C =    234.83440 [MHz]
  Nuclear repulsion =  772.892105981536133

  Charge       = 1
  Multiplicity = 1
  Electrons    = 98
  Nalpha       = 49
  Nbeta        = 49

  ==> Algorithm <==

  SCF Algorithm Type is DF.
  DIIS enabled.
  MOM disabled.
  Fractional occupation disabled.
  Guess Type is SAD.
  Energy threshold   = 1.00e-06
  Density threshold  = 1.00e-06
  Integral threshold = 1.00e-12

  ==> Primary Basis <==

  Basis Set: 6-311G*
    Blend: 6-311G*
    Number of shells: 105
    Number of basis functions: 221
    Number of Cartesian functions: 233
    Spherical Harmonics?: true
    Max angular momentum: 2

   => Loading Basis Set <=

    Name: (6-311G* AUX)
    Role: JKFIT
    Keyword: DF_BASIS_SCF
    atoms 1-4, 11, 13 entry C          line   125 file /Users/jfoley19/miniconda3/envs/psi4_new/share/psi4/basis/cc-pvtz-jkfit.gbs 
    atoms 5-7, 12, 14 entry H          line    51 file /Users/jfoley19/miniconda3/envs/psi4_new/share/psi4/basis/cc-pvtz-jkfit.gbs 
    atoms 8           entry N          line   177 file /Users/jfoley19/miniconda3/envs/psi4_new/share/psi4/basis/cc-pvtz-jkfit.gbs 
    atoms 9-10        entry O          line   229 file /Users/jfoley19/miniconda3/envs/psi4_new/share/psi4/basis/cc-pvtz-jkfit.gbs 
    atoms 15          entry BR         line  1289 file /Users/jfoley19/miniconda3/envs/psi4_new/share/psi4/basis/cc-pvtz-jkfit.gbs 

  ==> Integral Setup <==

  DFHelper Memory: AOs need 0.360 GiB; user supplied 2.794 GiB. 
  Using in-core AOs.

  ==> MemDFJK: Density-Fitted J/K Matrices <==

    J tasked:                   Yes
    K tasked:                   Yes
    wK tasked:                   No
    OpenMP threads:               1
    Memory [MiB]:              2861
    Algorithm:                 Core
    Schwarz Cutoff:           1E-12
    Mask sparsity (%):      12.3011
    Fitting Condition:        1E-10

   => Auxiliary Basis Set <=

  Basis Set: (6-311G* AUX)
    Blend: CC-PVTZ-JKFIT
    Number of shells: 326
    Number of basis functions: 1068
    Number of Cartesian functions: 1308
    Spherical Harmonics?: true
    Max angular momentum: 4

  Minimum eigenvalue in the overlap matrix is 3.2150816258E-04.
  Reciprocal condition number of the overlap matrix is 4.8063843961E-05.
    Using symmetric orthogonalization.

  ==> Pre-Iterations <==

  SCF Guess: Superposition of Atomic Densities via on-the-fly atomic UHF (no occupation information).

   -------------------------
    Irrep   Nso     Nmo    
   -------------------------
     A        221     221 
   -------------------------
    Total     221     221
   -------------------------

  ==> Iterations <==

                           Total Energy        Delta E     RMS |[F,P]|

   @DF-RHF iter SAD: -3004.19268963332615   -3.00419e+03   0.00000e+00 
   @DF-RHF iter   1: -3005.77556870284752   -1.58288e+00   8.31908e-03 DIIS/ADIIS
   @DF-RHF iter   2: -3006.02755195181498   -2.51983e-01   5.80250e-03 DIIS/ADIIS
   @DF-RHF iter   3: -3006.28196718560503   -2.54415e-01   5.95312e-04 DIIS/ADIIS
   @DF-RHF iter   4: -3006.28917399089823   -7.20681e-03   2.74981e-04 DIIS/ADIIS
   @DF-RHF iter   5: -3006.29107434197476   -1.90035e-03   4.76182e-05 DIIS
   @DF-RHF iter   6: -3006.29123537063424   -1.61029e-04   2.87383e-05 DIIS
   @DF-RHF iter   7: -3006.29127775879579   -4.23882e-05   1.27584e-05 DIIS
   @DF-RHF iter   8: -3006.29129230296485   -1.45442e-05   5.40259e-06 DIIS
   @DF-RHF iter   9: -3006.29129570886653   -3.40590e-06   2.34218e-06 DIIS
   @DF-RHF iter  10: -3006.29129646748379   -7.58617e-07   9.25009e-07 DIIS
  Energy and wave function converged.


  ==> Post-Iterations <==

    Orbital Energies [Eh]
    ---------------------

    Doubly Occupied:                                                      

       1A   -490.225309     2A    -65.358690     3A    -58.719173  
       4A    -58.716633     5A    -58.716611     6A    -20.772042  
       7A    -20.771940     8A    -16.024338     9A    -11.549538  
      10A    -11.536885    11A    -11.535160    12A    -11.531080  
      13A    -11.482833    14A    -11.470282    15A    -10.038537  
      16A     -7.653802    17A     -7.642286    18A     -7.642116  
      19A     -3.394044    20A     -3.388908    21A     -3.388745  
      22A     -3.374804    23A     -3.374803    24A     -1.756118  
      25A     -1.556054    26A     -1.421903    27A     -1.306215  
      28A     -1.295572    29A     -1.192023    30A     -1.145903  
      31A     -1.085467    32A     -1.032495    33A     -0.963831  
      34A     -0.908978    35A     -0.901406    36A     -0.881115  
      37A     -0.873216    38A     -0.859456    39A     -0.842314  
      40A     -0.781387    41A     -0.756234    42A     -0.738014  
      43A     -0.665466    44A     -0.660003    45A     -0.651515  
      46A     -0.625418    47A     -0.604530    48A     -0.598599  
      49A     -0.570314  

    Virtual:                                                              

      50A     -0.238038    51A     -0.122264    52A     -0.071532  
      53A     -0.030728    54A     -0.018249    55A      0.010231  
      56A      0.027713    57A      0.054883    58A      0.071034  
      59A      0.095754    60A      0.123004    61A      0.163900  
      62A      0.184243    63A      0.208576    64A      0.221542  
      65A      0.253206    66A      0.258557    67A      0.260356  
      68A      0.289835    69A      0.301988    70A      0.313824  
      71A      0.334128    72A      0.348242    73A      0.368829  
      74A      0.370932    75A      0.396143    76A      0.404611  
      77A      0.410757    78A      0.430953    79A      0.443373  
      80A      0.453001    81A      0.474153    82A      0.497904  
      83A      0.532299    84A      0.554011    85A      0.560296  
      86A      0.573509    87A      0.593963    88A      0.605370  
      89A      0.608159    90A      0.619763    91A      0.637687  
      92A      0.661419    93A      0.666042    94A      0.701608  
      95A      0.714162    96A      0.732575    97A      0.737169  
      98A      0.755203    99A      0.791054   100A      0.800771  
     101A      0.828241   102A      0.844857   103A      0.868855  
     104A      0.871520   105A      0.884298   106A      0.921616  
     107A      0.936044   108A      0.960004   109A      0.970009  
     110A      0.998528   111A      1.020702   112A      1.033398  
     113A      1.072442   114A      1.115303   115A      1.133840  
     116A      1.192041   117A      1.198624   118A      1.225046  
     119A      1.234435   120A      1.250219   121A      1.271960  
     122A      1.369154   123A      1.458762   124A      1.467525  
     125A      1.482638   126A      1.499347   127A      1.531917  
     128A      1.623720   129A      1.654324   130A      1.719401  
     131A      1.747229   132A      1.760043   133A      1.784387  
     134A      1.795095   135A      1.826263   136A      1.841086  
     137A      1.905451   138A      1.932960   139A      1.972771  
     140A      1.990808   141A      2.003903   142A      2.020669  
     143A      2.081893   144A      2.098131   145A      2.167471  
     146A      2.185288   147A      2.240404   148A      2.259699  
     149A      2.291286   150A      2.317266   151A      2.366388  
     152A      2.405709   153A      2.420764   154A      2.449712  
     155A      2.498103   156A      2.533710   157A      2.636999  
     158A      2.654546   159A      2.711461   160A      2.787560  
     161A      2.833985   162A      2.873720   163A      2.902032  
     164A      2.988988   165A      3.008337   166A      3.034492  
     167A      3.051814   168A      3.069606   169A      3.091629  
     170A      3.194016   171A      3.265421   172A      3.307554  
     173A      3.355284   174A      3.385924   175A      3.422598  
     176A      3.445541   177A      3.465001   178A      3.488066  
     179A      3.525336   180A      3.584547   181A      3.638632  
     182A      3.711075   183A      3.718903   184A      3.822217  
     185A      3.851230   186A      3.969998   187A      3.993284  
     188A      4.102110   189A      4.121329   190A      4.531615  
     191A      4.536279   192A      4.619114   193A      4.655964  
     194A      4.743761   195A      4.845535   196A      4.862798  
     197A      4.888081   198A      5.215794   199A      5.227895  
     200A      5.305099   201A      5.339839   202A      5.908373  
     203A      6.368418   204A      6.920232   205A      7.960427  
     206A      7.977188   207A      8.077627   208A     24.128412  
     209A     24.582445   210A     24.713261   211A     24.781400  
     212A     24.981706   213A     25.042490   214A     36.536595  
     215A     49.197397   216A     51.338245   217A     51.442744  
     218A    293.638390   219A    293.654026   220A    293.780075  
     221A   1028.113166  

    Final Occupation by Irrep:
              A 
    DOCC [    49 ]
    NA   [    49 ]
    NB   [    49 ]

  @DF-RHF Final Energy: -3006.29129646748379

   => Energetics <=

    Nuclear Repulsion Energy =            772.8921059815361332
    One-Electron Energy =               -5692.4019809383944448
    Two-Electron Energy =                1913.2185784893749769
    Total Energy =                      -3006.2912964674837895

Computation Completed


Properties will be evaluated at   0.000000,   0.000000,   0.000000 [a0]

Properties computed using the SCF density matrix


 Multipole Moments:

 ------------------------------------------------------------------------------------
     Multipole            Electronic (a.u.)      Nuclear  (a.u.)        Total (a.u.)
 ------------------------------------------------------------------------------------

 L = 1.  Multiply by 2.5417464519 to convert [e a0] to [Debye]
 Dipole X            :       -427.8466636          428.5954817            0.7488182
 Dipole Y            :        121.3658306         -121.5848832           -0.2190526
 Dipole Z            :        123.5098842         -123.6719098           -0.1620255
 Magnitude           :                                                    0.7968469

 ------------------------------------------------------------------------------------

*** tstop() called on CHEM9QDFT72ALT at Tue Jan 27 09:42:30 2026
Module time:
	user time   =       4.48 seconds =       0.07 minutes
	system time =       0.11 seconds =       0.00 minutes
	total time  =          4 seconds =       0.07 minutes
Total time:
	user time   =       4.48 seconds =       0.07 minutes
	system time =       0.11 seconds =       0.00 minutes
	total time  =          4 seconds =       0.07 minutes

*** tstart() called on CHEM9QDFT72ALT
*** at Tue Jan 27 09:42:30 2026

   => Libint2 <=

    Primary   basis highest AM E, G, H:  6, 6, 3
    Auxiliary basis highest AM E, G, H:  7, 7, 4
    Onebody   basis highest AM E, G, H:  -, -, -
    Solid Harmonics ordering:            Gaussian
   => Loading Basis Set <=

    Name: 6-311G*
    Role: ORBITAL
    Keyword: BASIS
    atoms 1-4, 11, 13 entry C          line   114 file /Users/jfoley19/miniconda3/envs/psi4_new/share/psi4/basis/6-311gs.gbs 
    atoms 5-7, 12, 14 entry H          line    37 file /Users/jfoley19/miniconda3/envs/psi4_new/share/psi4/basis/6-311gs.gbs 
    atoms 8           entry N          line   133 file /Users/jfoley19/miniconda3/envs/psi4_new/share/psi4/basis/6-311gs.gbs 
    atoms 9-10        entry O          line   152 file /Users/jfoley19/miniconda3/envs/psi4_new/share/psi4/basis/6-311gs.gbs 
    atoms 15          entry BR         line   819 file /Users/jfoley19/miniconda3/envs/psi4_new/share/psi4/basis/6-311gs.gbs 


         ---------------------------------------------------------
                                   SCF
               by Justin Turney, Rob Parrish, Andy Simmonett
                          and Daniel G. A. Smith
                              RHF Reference
                        1 Threads,   3814 MiB Core
         ---------------------------------------------------------

  ==> Geometry <==

    Molecular point group: c1
    Full point group: C1

    Geometry (in Angstrom), charge = 1, multiplicity = 1:

       Center              X                  Y                   Z               Mass       
    ------------   -----------------  -----------------  -----------------  -----------------
         C            0.519324750000     1.233034510000    -0.031949250000    12.000000000000
         C            1.944544130000     1.269163580000    -0.036728820000    12.000000000000
         C            2.620377930000     0.092834280000    -0.024990030000    12.000000000000
         C           -0.196033520000     0.030130620000     0.001027320000    12.000000000000
         H           -0.020694200000     2.174237640000    -0.043366460000     1.007825032230
         H            2.482816980000     2.208910570000    -0.036118790000     1.007825032230
         H           -1.277701370000     0.039902950000     0.011669530000     1.007825032230
         N            4.092134750000     0.095940760000     0.036629790000    14.003074004430
         O            4.639306960000    -1.021692750000     0.144592200000    15.994914619570
         O            4.664898830000     1.198396990000    -0.023275450000    15.994914619570
         C            0.494285180000    -1.167126490000     0.020997460000    12.000000000000
         H           -0.032510710000    -2.114926690000     0.054479350000     1.007825032230
         C            1.962911760000    -1.216532190000    -0.021113140000    12.000000000000
         H            2.443591130000    -1.963064330000     0.615138860000     1.007825032230
         BR           2.173040250000    -1.949121560000    -1.906187500000    78.918337600000

  Running in c1 symmetry.

  Rotational constants: A =      0.03196  B =      0.00967  C =      0.00783 [cm^-1]
  Rotational constants: A =    958.25927  B =    290.01491  C =    234.83440 [MHz]
  Nuclear repulsion =  772.892105981536133

  Charge       = 1
  Multiplicity = 1
  Electrons    = 98
  Nalpha       = 49
  Nbeta        = 49

  ==> Algorithm <==

  SCF Algorithm Type is DF.
  DIIS enabled.
  MOM disabled.
  Fractional occupation disabled.
  Guess Type is SAD.
  Energy threshold   = 1.00e-06
  Density threshold  = 1.00e-06
  Integral threshold = 1.00e-12

  ==> Primary Basis <==

  Basis Set: 6-311G*
    Blend: 6-311G*
    Number of shells: 105
    Number of basis functions: 221
    Number of Cartesian functions: 233
    Spherical Harmonics?: true
    Max angular momentum: 2

   => Loading Basis Set <=

    Name: (6-311G* AUX)
    Role: JKFIT
    Keyword: DF_BASIS_SCF
    atoms 1-4, 11, 13 entry C          line   125 file /Users/jfoley19/miniconda3/envs/psi4_new/share/psi4/basis/cc-pvtz-jkfit.gbs 
    atoms 5-7, 12, 14 entry H          line    51 file /Users/jfoley19/miniconda3/envs/psi4_new/share/psi4/basis/cc-pvtz-jkfit.gbs 
    atoms 8           entry N          line   177 file /Users/jfoley19/miniconda3/envs/psi4_new/share/psi4/basis/cc-pvtz-jkfit.gbs 
    atoms 9-10        entry O          line   229 file /Users/jfoley19/miniconda3/envs/psi4_new/share/psi4/basis/cc-pvtz-jkfit.gbs 
    atoms 15          entry BR         line  1289 file /Users/jfoley19/miniconda3/envs/psi4_new/share/psi4/basis/cc-pvtz-jkfit.gbs 

  ==> Integral Setup <==

  DFHelper Memory: AOs need 0.360 GiB; user supplied 2.794 GiB. 
  Using in-core AOs.

  ==> MemDFJK: Density-Fitted J/K Matrices <==

    J tasked:                   Yes
    K tasked:                   Yes
    wK tasked:                   No
    OpenMP threads:               1
    Memory [MiB]:              2861
    Algorithm:                 Core
    Schwarz Cutoff:           1E-12
    Mask sparsity (%):      12.3011
    Fitting Condition:        1E-10

   => Auxiliary Basis Set <=

  Basis Set: (6-311G* AUX)
    Blend: CC-PVTZ-JKFIT
    Number of shells: 326
    Number of basis functions: 1068
    Number of Cartesian functions: 1308
    Spherical Harmonics?: true
    Max angular momentum: 4

  Minimum eigenvalue in the overlap matrix is 3.2150816258E-04.
  Reciprocal condition number of the overlap matrix is 4.8063843961E-05.
    Using symmetric orthogonalization.

  ==> Pre-Iterations <==

  SCF Guess: Superposition of Atomic Densities via on-the-fly atomic UHF (no occupation information).

   -------------------------
    Irrep   Nso     Nmo    
   -------------------------
     A        221     221 
   -------------------------
    Total     221     221
   -------------------------

  ==> Iterations <==

                           Total Energy        Delta E     RMS |[F,P]|

   @DF-RHF iter SAD: -3004.19268963332615   -3.00419e+03   0.00000e+00 
   @DF-RHF iter   1: -3005.77556870284752   -1.58288e+00   8.31908e-03 DIIS/ADIIS
   @DF-RHF iter   2: -3006.02755195181498   -2.51983e-01   5.80250e-03 DIIS/ADIIS
   @DF-RHF iter   3: -3006.28196718560503   -2.54415e-01   5.95312e-04 DIIS/ADIIS
   @DF-RHF iter   4: -3006.28917399089823   -7.20681e-03   2.74981e-04 DIIS/ADIIS
   @DF-RHF iter   5: -3006.29107434197476   -1.90035e-03   4.76182e-05 DIIS
   @DF-RHF iter   6: -3006.29123537063424   -1.61029e-04   2.87383e-05 DIIS
   @DF-RHF iter   7: -3006.29127775879579   -4.23882e-05   1.27584e-05 DIIS
   @DF-RHF iter   8: -3006.29129230296485   -1.45442e-05   5.40259e-06 DIIS
   @DF-RHF iter   9: -3006.29129570886653   -3.40590e-06   2.34218e-06 DIIS
   @DF-RHF iter  10: -3006.29129646748379   -7.58617e-07   9.25009e-07 DIIS
  Energy and wave function converged.


  ==> Post-Iterations <==

    Orbital Energies [Eh]
    ---------------------

    Doubly Occupied:                                                      

       1A   -490.225309     2A    -65.358690     3A    -58.719173  
       4A    -58.716633     5A    -58.716611     6A    -20.772042  
       7A    -20.771940     8A    -16.024338     9A    -11.549538  
      10A    -11.536885    11A    -11.535160    12A    -11.531080  
      13A    -11.482833    14A    -11.470282    15A    -10.038537  
      16A     -7.653802    17A     -7.642286    18A     -7.642116  
      19A     -3.394044    20A     -3.388908    21A     -3.388745  
      22A     -3.374804    23A     -3.374803    24A     -1.756118  
      25A     -1.556054    26A     -1.421903    27A     -1.306215  
      28A     -1.295572    29A     -1.192023    30A     -1.145903  
      31A     -1.085467    32A     -1.032495    33A     -0.963831  
      34A     -0.908978    35A     -0.901406    36A     -0.881115  
      37A     -0.873216    38A     -0.859456    39A     -0.842314  
      40A     -0.781387    41A     -0.756234    42A     -0.738014  
      43A     -0.665466    44A     -0.660003    45A     -0.651515  
      46A     -0.625418    47A     -0.604530    48A     -0.598599  
      49A     -0.570314  

    Virtual:                                                              

      50A     -0.238038    51A     -0.122264    52A     -0.071532  
      53A     -0.030728    54A     -0.018249    55A      0.010231  
      56A      0.027713    57A      0.054883    58A      0.071034  
      59A      0.095754    60A      0.123004    61A      0.163900  
      62A      0.184243    63A      0.208576    64A      0.221542  
      65A      0.253206    66A      0.258557    67A      0.260356  
      68A      0.289835    69A      0.301988    70A      0.313824  
      71A      0.334128    72A      0.348242    73A      0.368829  
      74A      0.370932    75A      0.396143    76A      0.404611  
      77A      0.410757    78A      0.430953    79A      0.443373  
      80A      0.453001    81A      0.474153    82A      0.497904  
      83A      0.532299    84A      0.554011    85A      0.560296  
      86A      0.573509    87A      0.593963    88A      0.605370  
      89A      0.608159    90A      0.619763    91A      0.637687  
      92A      0.661419    93A      0.666042    94A      0.701608  
      95A      0.714162    96A      0.732575    97A      0.737169  
      98A      0.755203    99A      0.791054   100A      0.800771  
     101A      0.828241   102A      0.844857   103A      0.868855  
     104A      0.871520   105A      0.884298   106A      0.921616  
     107A      0.936044   108A      0.960004   109A      0.970009  
     110A      0.998528   111A      1.020702   112A      1.033398  
     113A      1.072442   114A      1.115303   115A      1.133840  
     116A      1.192041   117A      1.198624   118A      1.225046  
     119A      1.234435   120A      1.250219   121A      1.271960  
     122A      1.369154   123A      1.458762   124A      1.467525  
     125A      1.482638   126A      1.499347   127A      1.531917  
     128A      1.623720   129A      1.654324   130A      1.719401  
     131A      1.747229   132A      1.760043   133A      1.784387  
     134A      1.795095   135A      1.826263   136A      1.841086  
     137A      1.905451   138A      1.932960   139A      1.972771  
     140A      1.990808   141A      2.003903   142A      2.020669  
     143A      2.081893   144A      2.098131   145A      2.167471  
     146A      2.185288   147A      2.240404   148A      2.259699  
     149A      2.291286   150A      2.317266   151A      2.366388  
     152A      2.405709   153A      2.420764   154A      2.449712  
     155A      2.498103   156A      2.533710   157A      2.636999  
     158A      2.654546   159A      2.711461   160A      2.787560  
     161A      2.833985   162A      2.873720   163A      2.902032  
     164A      2.988988   165A      3.008337   166A      3.034492  
     167A      3.051814   168A      3.069606   169A      3.091629  
     170A      3.194016   171A      3.265421   172A      3.307554  
     173A      3.355284   174A      3.385924   175A      3.422598  
     176A      3.445541   177A      3.465001   178A      3.488066  
     179A      3.525336   180A      3.584547   181A      3.638632  
     182A      3.711075   183A      3.718903   184A      3.822217  
     185A      3.851230   186A      3.969998   187A      3.993284  
     188A      4.102110   189A      4.121329   190A      4.531615  
     191A      4.536279   192A      4.619114   193A      4.655964  
     194A      4.743761   195A      4.845535   196A      4.862798  
     197A      4.888081   198A      5.215794   199A      5.227895  
     200A      5.305099   201A      5.339839   202A      5.908373  
     203A      6.368418   204A      6.920232   205A      7.960427  
     206A      7.977188   207A      8.077627   208A     24.128412  
     209A     24.582445   210A     24.713261   211A     24.781400  
     212A     24.981706   213A     25.042490   214A     36.536595  
     215A     49.197397   216A     51.338245   217A     51.442744  
     218A    293.638390   219A    293.654026   220A    293.780075  
     221A   1028.113166  

    Final Occupation by Irrep:
              A 
    DOCC [    49 ]
    NA   [    49 ]
    NB   [    49 ]

  @DF-RHF Final Energy: -3006.29129646748379

   => Energetics <=

    Nuclear Repulsion Energy =            772.8921059815361332
    One-Electron Energy =               -5692.4019809383944448
    Two-Electron Energy =                1913.2185784893749769
    Total Energy =                      -3006.2912964674837895

Computation Completed


Properties will be evaluated at   0.000000,   0.000000,   0.000000 [a0]

Properties computed using the SCF density matrix


 Multipole Moments:

 ------------------------------------------------------------------------------------
     Multipole            Electronic (a.u.)      Nuclear  (a.u.)        Total (a.u.)
 ------------------------------------------------------------------------------------

 L = 1.  Multiply by 2.5417464519 to convert [e a0] to [Debye]
 Dipole X            :       -427.8466636          428.5954817            0.7488182
 Dipole Y            :        121.3658306         -121.5848832           -0.2190526
 Dipole Z            :        123.5098842         -123.6719098           -0.1620255
 Magnitude           :                                                    0.7968469

 ------------------------------------------------------------------------------------

*** tstop() called on CHEM9QDFT72ALT at Tue Jan 27 09:42:35 2026
Module time:
	user time   =       4.42 seconds =       0.07 minutes
	system time =       0.07 seconds =       0.00 minutes
	total time  =          5 seconds =       0.08 minutes
Total time:
	user time   =       8.91 seconds =       0.15 minutes
	system time =       0.18 seconds =       0.00 minutes
	total time  =          9 seconds =       0.15 minutes

    Psi4 stopped on: Tuesday, 27 January 2026 09:42AM
    Psi4 wall time for execution: 0:00:09.11

*** Psi4 exiting successfully. Buy a developer a beer!
